<?xml version="1.0" encoding="UTF-8"?>
<!--
ho so nhan vien
-->



<employee-list
    xmlns:xsi='http://www.w3.org/2001/XMLSchema-instance'
    xsi:noNamespaceSchemaLocation='employee.xsd'>
    <employee id="nv100">
        <name>Cat tuong</name>
        <gender>false</gender>
        <dob>2003-08-31</dob>
        <salary>1200</salary>
        <position>Nhan vien</position>
    </employee>
    
    <employee id="nv101">
        <name>Van An</name>
        <gender>true</gender>
        <dob>2000-12-31</dob>
        <salary>2000</salary>
        <position>Truong Phong</position>
    </employee>
    
    <employee id="nv102">
        <name>Phuoc tho</name>
        <gender>true</gender>
        <dob>2004-06-22</dob>
        <salary>1</salary>
        <position>Giam Doc</position>
    </employee>

</employee-list>

